videopath,caption,sa,pc
examples/A_wooden_spoon_stirs_the_hot_soup_in_the_pot._1.mp4,A wooden spoon stirs the hot soup in the pot.,0,0
examples/Shoe_squishes_a_bug._0.mp4,Shoe squishes a bug.,0,1
examples/A_spatula_scoops_up_cake_batter_into_a_baking_pan._0.mp4,A spatula scoops up cake batter into a baking pan.,1,1
examples/Pushpin_skates_across_a_glossy_desk_surface._1.mp4,Pushpin skates across a glossy desk surface.,1,0
examples/An_apple_falls_and_bounces_on_the_hard_ground._1.mp4,An apple falls and bounces on the hard ground.,1,1
examples/Coffee_accepting_a_gentle_pour_of_milk_1.mp4,Coffee accepting a gentle pour of milk.,0,0
examples/A_car_brush_lathers_shampoo_onto_a_dirty_vehicle_1.mp4,A car brush lathers shampoo onto a dirty vehicle.,0,1